{
  "goal": "Review the provided patch, identify key risks, and draft release notes for the change",
  "scope": "Review only the provided diff and related notes; do not modify code or broaden to unrelated modules",
  "constraints": [
    "Keep the review scoped to the submitted patch",
    "Distinguish verified findings from speculative concerns",
    "Draft release notes in concise product language"
  ],
  "success_criteria": [
    "Identifies major risks or review concerns",
    "Produces a draft release note",
    "Clearly labels unverified assumptions"
  ],
  "inputs": {
    "provided": [
      "patch.diff",
      "release-context.md"
    ],
    "missing": [
      "Test results if available"
    ]
  },
  "assumptions": [
    "Assume the diff is the only intended review scope",
    "Assume release notes are internal-draft quality unless stated otherwise"
  ],
  "risk_level": "medium",
  "approval_required": false,
  "requested_output": "review_notes_and_release_note_draft",
  "next_actor": "coding-adapter",
  "task_type": [
    "code_review",
    "release_preparation"
  ],
  "audience": "engineering",
  "priority": "normal",
  "stage": "review",
  "completion_definition": "Done when review notes and a release note draft are prepared from the provided patch",
  "fallback_if_blocked": "If test evidence is missing, complete the review with explicit uncertainty"
}